1月19日，得胜沙路步行街街道办收取费用，允许流动摊贩在此营业，引发得胜沙路业主集体停业。得胜沙路是禁止流动摊贩在此营业的。经过调查，收取费用的行为是临时工私自行为，收取流动摊贩的费用已全部返还，业主们已经正常营业。	又是临时工？海口得胜沙路业主集体讨权利！
1月16日，省委常委、政法委书记、常务副省长毛超峰在海口主持召开中央驻琼单位座谈会，就将提交今年两会审议的《政府工作报告(征求意见稿)》征求意见建议。据悉，这是毛超峰首次以海南省常务副省长身份在媒体上亮相。	毛超峰任海南省常务副省长
“感动海南”人物评选已开展几年，一个个闪亮的名字和群体，用他们爱和正能量感动着所有人，传播着爱和正能量，弘扬着人性之美。在他们身上，我们看到了坚强和毅力，更看到了爱与责任，激励着我们每一个人	“感动海南”：以草根情怀弘扬人性之美
有村民举报，称三亚市南丁村一名村干部嫁女儿大摆宴席。记者暗访发现虽是在村里自办酒席，但婚宴酒桌数目在50桌以上。三亚市纪委表示，据中央规定，各级党员干部，包括村干部在内，办婚宴、乔迁、生日等酒宴都必须在6桌以内…	三亚村干部嫁女摆50多桌宴席遭举报超标了
“蜀生走了！”1月17日早晨6时许，一群熬夜写稿的记者和夜班编辑们在熟睡中被手机铃声惊醒。从四川省自贡日报到海南日报，32年从未间断过心中的新闻理想，临退休之际受命创建海南日报全媒体视觉中心，打造上百块示范新闻版。	海南“报痴”王蜀生走了：一生玩命干新闻刚退休
今日上午8点左右，海口一辆客运中巴车在海口红城湖烟草公司附近发生自燃，所幸的是车上4名乘客及时逃生，没有造成无人员伤亡。记者向现场民警了解到，车子自燃起火有可能是因为线路短路导致，但具体原因还在调查当中。	海口一客运中巴车发生自燃，只剩“骨架”
今天上午，有市民向南海网记者反映，海口金盘头铺菜市场路边一家“双汇”的猪肉摊被砸了，原因是这里的肉价太便宜。记者来到摊位，现场一片狼藉，帐篷已被拆断，猪肉零散一地，电子称也被砸坏。这...猪肉卖得便宜也不行？	海口：路边猪肉太便宜被砸了
“开着几十万元的豪车，居然连8块钱一碗的腌粉都不愿意付。”今天上午，市民李先生在海口蓝天路一家琼园鸡饭店，目睹到一男子驾驶捷豹轿车吃完东西“逃单”的一幕。当时就惊呆了......那辆黑色的捷豹价值至少价值70万元啊	海口：男子开捷豹吃腌粉逃单
英国时间一月17日的下午，周杰伦昆凌于英国SelbyAbbey教堂举办婚礼，在两位牧师的见证下，两人互换戒指，交换誓约，完成了终身大事！还记得，80后90后的青春里有一个人叫周杰伦，他的歌几乎伴随了整个学生时代。昆凌，照顾好我们的青春	周杰伦昆凌婚啦！
16日起，机场将专门提供旅客在停车场与航站楼之间免费乘坐的纯电动旅客摆渡车，每20分钟一趟，行车路线为：国内候机楼到达厅C口至停车场收费口出口处往返，全程行车时间约为10分钟。	美兰机场开通停车场-候机楼免费摆渡车啦
海口某航空售票处一名负责人郑某帅，以高额回报为饵，大肆向身边熟人“借款”，总金额或达上千万元，引起海口警方的关注。日前，犯罪嫌疑人郑某帅已投案自首。昨日接受采访时，他表示后悔，称自己给自己挖了一个坑，希望得到受害者的原谅。	借上千万元跑路的人自首了！
有“抗癌药代购第一人”之称陆勇为千余网友分享购买印度抗癌药渠道，于去年7月因“妨害信用卡管理”和“销售假药罪”被检察机关起诉。检察机关现已撤回诉讼，陆勇获释>>>	“抗癌药代购第一人”已获释检方主动撤诉
新《车辆购置税征收管理办法》将转变职能下放管理权限，优化流程减轻办税负担；食品生产经营者的主体责任将强化，食品安全承检机构应当对检验工作负责；重大税务案件当事人要求听证必须组织听证…2015年2月1日起，一批法律法规将开始实施	一批法律法规2月1日起实施
根据社会举报，中国记协近日查处了中国经营报、南方周末、中国产经新闻等媒体3起虚假、失实报道。涉事媒体与记者有的报道失实，有的偏听偏信、断章取义；有的甚至故意编造虚假内容，有关行政主管部门正进行立案查处。	中国记协通报３起虚假、失实报道
中国民间文化艺术之乡、海南琼剧之乡——定安的一帮琼剧票友将为逛年货展的市民免费送上一场琼剧大戏。定安是琼剧文化之乡，黄竹镇素来有浓厚的琼剧文化氛围，无论老少都爱学、爱听、爱唱。戳链接（）跟着南海君一起来体验一番！	来，感受一下传统的“海南戏”
“感动海南”人物评选已开展了几年，一个个闪亮的名字和群体，用他们爱和正能量感动着所有人，传播着爱和正能量，弘扬着人性之美。作为主办的媒体，无疑也用独特的视角和情怀在感受和记录着这些浓浓的善与爱。	“感动海南”：以草根情怀弘扬人性之美
针对黑龙江讷河监狱案暴露出的内部管理问题，司法部部署，将全面加强监所管理，并在全国监狱戒毒场所开展违禁品、违规品专项清缴和严明纪律严格履职专项教育等活动。私带违禁品给罪犯的干警一律开除!	司法部：认真汲取讷河监狱案件教训全面加强监所管理
1月15日“感动海南”2014年度人物揭晓，再一次让这个充满爱和善的岛屿绽放光芒，省委书记“为凡人善举点赞为草根英雄站台”，激励和鼓舞更多人加入到传递爱和正能量的行列。带话题#为海南凡人善举点赞#转发有惊喜！	传递海南正能量转发也是一种力量
去年5月12日，中国公证协会印发《关于进一步加强以公信力建设为重点的公证行风建设的意见》。随后，全国公证行业因地制宜开展了一系列实践活动，基本做到了全面布置、全员参与、全面检验、全面提升。	全国公证行业：开门实践让群众感知公信力
“感动海南”“感动你我”……今晚“感动海南”2014年度十大人物评选颁奖典礼已圆满结束了。2015年，我们将继续为凡人善举、美德义行点赞，让我们一同致敬这群最可爱的人。	致敬！“感动海南”这群最可爱的人
春运是全年客流量最集中的时期，也是道路交通事故易发高发期。针对春运期间最易导致事故的八类交通违法行为，公安部交管局２７日公布了一批近年典型案例，提醒每一位春运交通参与者安全文明出行、平安回家过年。	一批春运道路交通事故典型案例公布
最高法院第一巡回法庭将于今天上午在深圳正式挂牌。根据中央批准的试点方案，最高法第一和第二巡回法庭分别设于广东省深圳市和辽宁省沈阳市，两个巡回法庭将于今年年初开始受理、审理案件。	最高法第一巡回法庭今日挂牌判决效力等同于最高法
“感动海南”2014十大年度人物评选活动，1月15日晚将现场揭晓感动海南十大人物获奖者。南海网将全程进行图文滚动报道，视频直播！PS:与感动人物共同分享成功的喜悦容易留下泪水，入场观众务必提前准备好纸巾或小手绢。	“感动海南”2014十大年度人物今晚直播
昨天，中国银监会批复同意海南筹建海南银行股份有限公司，海南银行前身是临高金牌城市信用社。银行30亿股总股本中民营股份占53%。以重点服务中小微企业和城乡居民为市场定位。同时将互联网金融作为海南银行未来发展的重点方向之一。	海南银行获银监会批准筹建
